{
  "card_id": "CT-2026-08-29-E",
  "graded_at": "2026-08-30T23:12:38+00:00",
  "source": "equibase_official_chart",
  "races": [
    {
      "race_number": 7,
      "winner_program": "6",
      "outcome": "hit",
      "confidence_at_publication": "single",
      "revision_applied": false,
      "winner_horse": "Tricks R for Juba",
      "win_payoff": 4.8
    },
    {
      "race_number": 8,
      "winner_program": "7",
      "outcome": "hit",
      "confidence_at_publication": "spread",
      "revision_applied": false,
      "winner_horse": "Jester's Song",
      "win_payoff": 20.4
    }
  ],
  "totals": {
    "races_carded": 2,
    "races_played": 2,
    "no_plays": 0,
    "hits": 2,
    "coverage_rate": 1.0,
    "alternate_wins": 0,
    "by_confidence": {
      "single": {
        "played": 1,
        "hits": 1,
        "rate": 1.0
      },
      "spread": {
        "played": 1,
        "hits": 1,
        "rate": 1.0
      }
    }
  }
}
